### ISSUE TITLE
Grafana not working

### ISSUE THREAD

**Issue by AlejandraOliver** [srsran/srsRAN_Project#1089]
Hi, I follow this tutorial: https://docs.srsran.com/projects/project/en/latest/tutorials/source/near-rt-ric/source/index.html

and also I follow this in order to view results on grafana: https://docs.srsran.com/projects/project/en/latest/user_manuals/source/grafana_gui.html

Everything works fine excepto Grafana, the metric server is receiving the data but the infludb receive 0 in ul_brate when I'm doing:
_________________________

```
srsran@srsran-VirtualBox:~$ sudo ip netns exec ue1 iperf -c 10.45.1.1 -u -b 10M -i 1 -t 60

Client connecting to 10.45.1.1, UDP port 5001

Sending 1470 byte datagrams, IPG target: 1121.52 us (kalman adjust)

UDP buffer size:  208 KByte (default)

[  1] local 10.45.1.2 port 43153 connected with 10.45.1.1 port 5001

[ ID] Interval       Transfer     Bandwidth

[  1] 0.0000-1.0000 sec  1.25 MBytes  10.5 Mbits/sec

[  1] 1.0000-2.0000 sec  1.25 MBytes  10.5 Mbits/sec

[  1] 2.0000-3.0000 sec  1.25 MBytes  10.5 Mbits/sec

^C[  1] 0.0000-3.3467 sec  4.19 MBytes  10.5 Mbits/sec

[  1] Sent 2987 datagrams

read failed: Connection refused

read failed: Connection refused
```
___________________________________________________________________

Here I show that the metric server is catching data but influxdb no, so in Grafana dashboard I see 0bps:
___________________________________________________________________________

```
srsran@srsran-VirtualBox:~$ sudo tcpdump -i any udp port 55555 -A

tcpdump: data link type LINUX_SLL2

tcpdump: verbose output suppressed, use -v[v]... for full protocol decode

listening on any, link-type LINUX_SLL2 (Linux cooked v2), snapshot length 262144 bytes

16:43:33.677414 br-1346fa3c860b Out IP srsran-VirtualBox.49515 > 172.19.1.4.55555: UDP, length 794

E..6. @.@.?k.........k..."]_{

  "timestamp": 1741535013.676,

  "cell_metrics": {

    "error_indication_count": 0,

    "average_latency": 113,

    "latency_histogram": [45, 584, 217, 75, 31, 24, 5, 3, 3, 13]

  },

  "ue_list": [

    {

      "ue_container": {

        "pci": 1,

        "rnti": 17921,

        "cqi": 15,

        "ri": 1,

        "dl_mcs": 27,

        "dl_brate": 72736,

        "dl_nof_ok": 93,

        "dl_nof_nok": 0,

        "dl_bs": 0,

        "pusch_snr_db": 42.844353,

        "pucch_snr_db": 27.586252,

        "ta_ns": "519.812829",

        "pusch_ta_ns": "519.816069",

        "pucch_ta_ns": "518.798856",

        "srs_ta_ns": "n/a",

        "ul_mcs": 28,

        "ul_brate": 24847960,

        "ul_nof_ok": 937,

        "ul_nof_nok": 0,

        "bsr": 2014

      }

    }

  ],

  "event_list": [

  ]

}



16:43:33.677428 veth182d531 Out IP srsran-VirtualBox.49515 > 172.19.1.4.55555: UDP, length 794

E..6. @.@.?k.........k..."]_{

  "timestamp": 1741535013.676,

  "cell_metrics": {

    "error_indication_count": 0,

    "average_latency": 113,

    "latency_histogram": [45, 584, 217, 75, 31, 24, 5, 3, 3, 13]

  },

  "ue_list": [

    {

      "ue_container": {

        "pci": 1,

        "rnti": 17921,

        "cqi": 15,

        "ri": 1,

        "dl_mcs": 27,

        "dl_brate": 72736,

        "dl_nof_ok": 93,

        "dl_nof_nok": 0,

        "dl_bs": 0,

        "pusch_snr_db": 42.844353,

        "pucch_snr_db": 27.586252,

        "ta_ns": "519.812829",

        "pusch_ta_ns": "519.816069",

        "pucch_ta_ns": "518.798856",

        "srs_ta_ns": "n/a",

        "ul_mcs": 28,

        "ul_brate": 24847960,

        "ul_nof_ok": 937,

        "ul_nof_nok": 0,

        "bsr": 2014

      }

    }

  ],

  "event_list": [

  ]

}



16:43:35.029203 br-1346fa3c860b Out IP srsran-VirtualBox.49515 > 172.19.1.4.55555: UDP, length 788

E..0..@.@.=..........k....]Y{

  "timestamp": 1741535015.028,

  "cell_metrics": {

    "error_indication_count": 0,

    "average_latency": 60,

    "latency_histogram": [590, 307, 57, 22, 6, 4, 4, 4, 1, 5]

  },

  "ue_list": [

    {

      "ue_container": {

        "pci": 1,

        "rnti": 17921,

        "cqi": 15,

        "ri": 1,

        "dl_mcs": 27,

        "dl_brate": 59136,

        "dl_nof_ok": 86,

        "dl_nof_nok": 0,

        "dl_bs": 0,

        "pusch_snr_db": 42.246178,

        "pucch_snr_db": 30.79756,

        "ta_ns": "519.661342",

        "pusch_ta_ns": "519.810499",

        "pucch_ta_ns": "519.123489",

        "srs_ta_ns": "n/a",

        "ul_mcs": 28,

        "ul_brate": 2898504,

        "ul_nof_ok": 170,

        "ul_nof_nok": 0,

        "bsr": 2014

      }

    }

  ],

  "event_list": [

  ]

}



16:43:35.029212 veth182d531 Out IP srsran-VirtualBox.49515 > 172.19.1.4.55555: UDP, length 788

E..0..@.@.=..........k....]Y{

  "timestamp": 1741535015.028,

  "cell_metrics": {

    "error_indication_count": 0,

    "average_latency": 60,

    "latency_histogram": [590, 307, 57, 22, 6, 4, 4, 4, 1, 5]

  },

  "ue_list": [

    {

      "ue_container": {

        "pci": 1,

        "rnti": 17921,

        "cqi": 15,

        "ri": 1,

        "dl_mcs": 27,

        "dl_brate": 59136,

        "dl_nof_ok": 86,

        "dl_nof_nok": 0,

        "dl_bs": 0,

        "pusch_snr_db": 42.246178,

        "pucch_snr_db": 30.79756,

        "ta_ns": "519.661342",

        "pusch_ta_ns": "519.810499",

        "pucch_ta_ns": "519.123489",

        "srs_ta_ns": "n/a",

        "ul_mcs": 28,

        "ul_brate": 2898504,

        "ul_nof_ok": 170,

        "ul_nof_nok": 0,

        "bsr": 2014

      }

    }

  ],

  "event_list": [

  ]

}



^C

4 packets captured

32 packets received by filter

0 packets dropped by kernel
```
___________________________________________________________________

```
srsran@srsran-VirtualBox:~$ curl -X POST "http://172.19.1.5:8086/api/v2/query?org=srs"   --header "Authorization: Token 605bc59413b7d5457d181ccf20f9fda15693f81b068d70396cc183081b264f3b"   --header "Content-Type: application/vnd.flux"   --data '

from(bucket: "srsran")

  |> range(start: -1h)  // Última hora de datos

  |> filter(fn: (r) => r["_measurement"] == "ue_info")

  |> filter(fn: (r) => r["_field"] == "ul_brate")

  |> sort(columns: ["_time"], desc: true)

  |> limit(n: 10)  // Mostrar los últimos 10 datos

'

,result,table,_start,_stop,_time,_value,_field,_measurement,pci,rnti,testbed

,_result,0,2025-03-09T14:43:36.983819967Z,2025-03-09T15:43:36.983819967Z,2025-03-09T15:42:32.186Z,0,ul_brate,ue_info,1,4601,default

,_result,0,2025-03-09T14:43:36.983819967Z,2025-03-09T15:43:36.983819967Z,2025-03-09T15:42:30.916Z,0,ul_brate,ue_info,1,4601,default

,_result,0,2025-03-09T14:43:36.983819967Z,2025-03-09T15:43:36.983819967Z,2025-03-09T15:42:29.689Z,0,ul_brate,ue_info,1,4601,default

,_result,0,2025-03-09T14:43:36.983819967Z,2025-03-09T15:43:36.983819967Z,2025-03-09T15:42:28.503Z,0,ul_brate,ue_info,1,4601,default

,_result,0,2025-03-09T14:43:36.983819967Z,2025-03-09T15:43:36.983819967Z,2025-03-09T15:42:27.213Z,0,ul_brate,ue_info,1,4601,default

,_result,0,2025-03-09T14:43:36.983819967Z,2025-03-09T15:43:36.983819967Z,2025-03-09T15:42:25.999Z,0,ul_brate,ue_info,1,4601,default

,_result,0,2025-03-09T14:43:36.983819967Z,2025-03-09T15:43:36.983819967Z,2025-03-09T15:42:24.713Z,0,ul_brate,ue_info,1,4601,default

,_result,0,2025-03-09T14:43:36.983819967Z,2025-03-09T15:43:36.983819967Z,2025-03-09T15:41:39.018Z,0,ul_brate,ue_info,1,4601,default

,_result,0,2025-03-09T14:43:36.983819967Z,2025-03-09T15:43:36.983819967Z,2025-03-09T15:41:34.043Z,0,ul_brate,ue_info,1,4601,default

,_result,0,2025-03-09T14:43:36.983819967Z,2025-03-09T15:43:36.983819967Z,2025-03-09T15:41:32.876Z,0,ul_brate,ue_info,1,4601,default
```
_______________________________________________________________________________________
The important config files are attached below.

gnb_zmq.yaml:
```
# This configuration file example shows how to configure the srsRAN Project gNB to allow srsUE to connect to it. 

# This specific example uses ZMQ in place of a USRP for the RF-frontend, and creates an FDD cell with 10 MHz bandwidth. 

# To run the srsRAN Project gNB with this config, use the following command: 

#   sudo ./gnb -c gnb_zmq.yaml



cu_cp:

  amf:

    addr: 10.53.1.2                 # The address or hostname of the AMF.

    port: 38412

    bind_addr: 10.53.1.1            # A local IP that the gNB binds to for traffic from the AMF.

    supported_tracking_areas:

      - tac: 7

        plmn_list:

          - plmn: "00101"

            tai_slice_support_list:

              - sst: 1

  inactivity_timer: 7200            # Sets the UE/PDU Session/DRB inactivity timer to 7200 seconds. Supported: [1 - 7200].



ru_sdr:

  device_driver: zmq                # The RF driver name.

  device_args: tx_port=tcp://127.0.0.1:2000,rx_port=tcp://127.0.0.1:2001,base_srate=11.52e6 # Optionally pass arguments to the selected RF driver.

  srate: 11.52                      # RF sample rate might need to be adjusted according to selected bandwidth.

  tx_gain: 75                       # Transmit gain of the RF might need to adjusted to the given situation.

  rx_gain: 75                       # Receive gain of the RF might need to adjusted to the given situation.



cell_cfg:

  dl_arfcn: 368500                  # ARFCN of the downlink carrier (center frequency).

  band: 3                           # The NR band.

  channel_bandwidth_MHz: 10         # Bandwith in MHz. Number of PRBs will be automatically derived.

  common_scs: 15                    # Subcarrier spacing in kHz used for data.

  plmn: "00101"                     # PLMN broadcasted by the gNB.

  tac: 7                            # Tracking area code (needs to match the core configuration).

  pdcch:

    common:

      ss0_index: 0                  # Set search space zero index to match srsUE capabilities

      coreset0_index: 6             # Set search CORESET Zero index to match srsUE capabilities

    dedicated:

      ss2_type: common              # Search Space type, has to be set to common

      dci_format_0_1_and_1_1: false # Set correct DCI format (fallback)

  prach:

    prach_config_index: 1           # Sets PRACH config to match what is expected by srsUE

  pdsch:

    mcs_table: qam64                # Sets PDSCH MCS to 64 QAM

  pusch:

    mcs_table: qam64                # Sets PUSCH MCS to 64 QAM



log:

  filename: /tmp/gnb.log            # Path of the log file.

  all_level: info                   # Logging level applied to all layers.

  hex_max_size: 0



pcap:

  mac_enable: false                 # Set to true to enable MAC-layer PCAPs.

  mac_filename: /tmp/gnb_mac.pcap   # Path where the MAC PCAP is stored.

  ngap_enable: false                # Set to true to enable NGAP PCAPs.

  ngap_filename: /tmp/gnb_ngap.pcap # Path where the NGAP PCAP is stored.

  e2ap_enable: true                 # Set to true to enable E2AP PCAPs.

  e2ap_du_filename: /tmp/gnb_du_e2ap.pcap        # Path where the DU E2AP PCAP is stored.

  e2ap_cu_cp_filename: /tmp/gnb_cu_cp_e2ap.pcap  # Path where the CU-CP E2AP PCAP is stored.

  e2ap_cu_up_filename: /tmp/gnb_cu_up_e2ap.pcap  # Path where the CU-UP E2AP PCAP is stored.



e2:

  enable_du_e2: true                # Enable DU E2 agent (one for each DU instance)

  e2sm_kpm_enabled: true            # Enable KPM service module

  e2sm_rc_enabled: true             # Enable RC service module

  addr: 127.0.0.1                   # RIC IP address

  #bind_addr: 127.0.0.100           # A local IP that the E2 agent binds to for traffic from the RIC. ONLY required if running the RIC on a separate machine. 

  port: 36421                       # RIC port



metrics: 

  enable_json_metrics: true       # Enable reporting metrics in JSON format

  addr: 172.19.1.4                # Metrics-server IP

  port: 55555                     # Metrics-server Port
```
______________________________
ue_zmq.conf:
```
[rf]

freq_offset = 0

tx_gain = 50

rx_gain = 40

srate = 11.52e6

nof_antennas = 1



device_name = zmq

device_args = tx_port=tcp://127.0.0.1:2001,rx_port=tcp://127.0.0.1:2000,base_srate=11.52e6



[rat.eutra]

dl_earfcn = 2850

nof_carriers = 0



[rat.nr]

bands = 3

nof_carriers = 1



[pcap]

enable = none

mac_filename = /tmp/ue_mac.pcap

mac_nr_filename = /tmp/ue_mac_nr.pcap

nas_filename = /tmp/ue_nas.pcap



[log]

all_level = info

phy_lib_level = none

all_hex_limit = 32

filename = /tmp/ue.log

file_max_size = -1



[usim]

mode = soft

algo = milenage

opc  = 63BFA50EE6523365FF14C1F45F88737D

k    = 00112233445566778899aabbccddeeff

imsi = 001010123456780

imei = 353490069873319



[rrc]

release = 15

ue_category = 4



[nas]

apn = srsapn

apn_protocol = ipv4



[gw]

netns = ue1

ip_devname = tun_srsue

ip_netmask = 255.255.255.0



[gui]

enable = false
```
__________________________________________
(routing is configured fine too).
Thanks!!!

**Comment by BGarcs** [comment]
I have the same problem, were you able to solve it?

**Comment by AlejandraOliver** [comment]
Hi!! suddenly, turning it back on worked for me, but nothing special!

Sorry!!
